,res,qs_path,path,path_length
0,ARG97 A,0.9142843154519101,ALA146 A_ASN116 A_ILE84 A_THR124 A_THR87 A_LYS88 A_ASP92 A_ILE93 A_ARG97 A,8
1,LYS101 A,0.913540587753921,ALA146 A_ASN116 A_ILE84 A_THR124 A_THR87 A_LYS88 A_ASP92 A_ILE93 A_ARG97 A_LYS101 A,9
2,ASP107 A,0.762197695844809,ALA146 A_LEU19 A_VAL114 A_CYS80 A_ILE100 A_LYS101 A_SER106 A_ASP107 A,7
3,VAL109 A,0.9179114517375243,ALA146 A_ASN116 A_GLY115 A_ILE142 A_LEU113 A_VAL112 A_PHE78 A_PRO110 A_VAL109 A,8
4,MET111 A,0.904326806840246,ALA146 A_ASN116 A_PHE82 A_VAL114 A_CYS80 A_VAL112 A_MET111 A,6
5,TYR137 A,0.8151514891486448,ALA146 A_ASN116 A_ILE84 A_VAL125 A_GLU126 A_GLN129 A_LEU133 A_TYR137 A,7
6,HOH366 A,0.7462346339262186,ALA146 A_LEU19 A_VAL114 A_CYS80 A_ILE100 A_VAL109 A_ASP108 A_HOH366 A,7
7,HOH392 A,0.5575446122521318,ALA146 A_ASN116 A_PHE82 A_LEU113 A_LEU133 A_SER136 A_HOH392 A,6
